{
  "schemaVersion": "1.0.0",
  "id": "shikoku-88-awa",
  "name": "Awa (Temples 1-23)",
  "country": "JP",
  "region": "Asia",
  "distanceKm": 154.5,
  "stageCount": 5,
  "tradition": "buddhist",
  "summary": "The first of the four dōjō: Temple 1 Ryōzen-ji to Temple 23 Yakuō-ji, 154.5 km along 22 temple-to-temple henro trail relations. The gentlest of the four to pace — no leg between two temples runs longer than 22.7 km, so every day of it can end at a temple. Awa carries the first of the four stages of spiritual progression the pilgrimage maps onto Shikoku's four provinces: awakening.",
  "stages": [
    {
      "index": 0,
      "name": "Ryōzen-ji (Temple 1) to Kirihata-ji (Temple 10)",
      "distanceKm": 28.3,
      "hours": {
        "min": 6,
        "max": 9
      },
      "gainMeters": 290,
      "difficulty": ""
    },
    {
      "index": 1,
      "name": "Kirihata-ji (Temple 10) to Sudachi-an",
      "distanceKm": 24.3,
      "hours": {
        "min": 7,
        "max": 9
      },
      "gainMeters": 1120,
      "difficulty": ""
    },
    {
      "index": 2,
      "name": "Sudachi-an to Ido-ji (Temple 17)",
      "distanceKm": 26.9,
      "hours": {
        "min": 6,
        "max": 8
      },
      "gainMeters": 290,
      "difficulty": ""
    },
    {
      "index": 3,
      "name": "Ido-ji (Temple 17) to GuestHouse & Cafe Green House",
      "distanceKm": 52.9,
      "hours": {
        "min": 12,
        "max": 17
      },
      "gainMeters": 1140,
      "difficulty": ""
    },
    {
      "index": 4,
      "name": "GuestHouse & Cafe Green House to Yakuō-ji (Temple 23)",
      "distanceKm": 22.1,
      "hours": {
        "min": 5,
        "max": 7
      },
      "gainMeters": 440,
      "difficulty": ""
    }
  ]
}
