{
  "schemaVersion": "1.0.0",
  "id": "kumano-kodo-nakahechi",
  "name": "Nakahechi (Central Route)",
  "country": "JP",
  "region": "Asia",
  "distanceKm": 36,
  "stageCount": 4,
  "tradition": "mixed",
  "summary": "The central route across the Kii Peninsula: 36 km from Takijiri-oji to Kumano Hongu Taisha by way of Takahara and Chikatsuyu-oji, climbing 2,230 m across four days. The shortest of the four Kumano Kodo routes.",
  "stages": [
    {
      "index": 0,
      "name": "Takijiri-oji to Takahara",
      "distanceKm": 3.6,
      "hours": {
        "min": 2,
        "max": 3
      },
      "gainMeters": 430,
      "difficulty": "moderate"
    },
    {
      "index": 1,
      "name": "Takahara to Chikatsuyu-oji",
      "distanceKm": 9,
      "hours": {
        "min": 4,
        "max": 6
      },
      "gainMeters": 830,
      "difficulty": "hard"
    },
    {
      "index": 2,
      "name": "Chikatsuyu-oji to Hosshinmon-oji",
      "distanceKm": 15.9,
      "hours": {
        "min": 6,
        "max": 8
      },
      "gainMeters": 780,
      "difficulty": "hard"
    },
    {
      "index": 3,
      "name": "Hosshinmon-oji to Kumano Hongu Taisha",
      "distanceKm": 7.5,
      "hours": {
        "min": 2,
        "max": 3
      },
      "gainMeters": 190,
      "difficulty": "easy"
    }
  ],
  "names": {
    "ja": "中辺路"
  }
}
